{
  "created_at": "2026-10-02T07:52:17Z",
  "issue_number": 6077,
  "issue_url": "https://github.com/shubhodeep1/coding-workflows/issues/6077",
  "lineage_id": "issue-6077",
  "memory_record_ids": [],
  "prs": [
    {
      "pr_number": 6079,
      "state": "merged",
      "url": "https://github.com/shubhodeep1/coding-workflows/pull/6079"
    }
  ],
  "runs": [
    {
      "run_attempt": 1,
      "run_id": "36979374071",
      "status": "in_progress",
      "timestamp": "2026-10-02T07:52:17Z",
      "workflow": "implement"
    },
    {
      "run_attempt": 1,
      "run_id": "36998019086",
      "status": "merged",
      "timestamp": "2026-10-02T10:55:37Z",
      "workflow": "Internal: Issue-PR Status Sync"
    }
  ],
  "schema_version": "task_lineage.v1",
  "state": "merged",
  "updated_at": "2026-10-02T10:55:37Z"
}
