{
  "created_at": "2026-06-18T11:49:01Z",
  "issue_number": 3405,
  "issue_url": "https://github.com/shubhodeep1/coding-workflows/issues/3405",
  "lineage_id": "issue-3405",
  "memory_record_ids": [],
  "prs": [
    {
      "pr_number": 3406,
      "state": "in_progress",
      "url": "https://github.com/shubhodeep1/coding-workflows/pull/3406"
    }
  ],
  "runs": [
    {
      "run_attempt": 1,
      "run_id": "27756998850",
      "status": "in_progress",
      "timestamp": "2026-06-18T11:49:01Z",
      "workflow": "implement"
    }
  ],
  "schema_version": "task_lineage.v1",
  "state": "in_progress",
  "updated_at": "2026-06-18T11:49:01Z"
}
