{
  "created_at": "2026-10-23T19:31:14Z",
  "issue_number": 8011,
  "issue_url": "https://github.com/shubhodeep1/coding-workflows/issues/8011",
  "lineage_id": "issue-8011",
  "memory_record_ids": [],
  "prs": [
    {
      "pr_number": 8021,
      "state": "closed",
      "url": "https://github.com/shubhodeep1/coding-workflows/pull/8021"
    }
  ],
  "runs": [
    {
      "run_attempt": 1,
      "run_id": "40008653794",
      "status": "in_progress",
      "timestamp": "2026-10-23T19:31:14Z",
      "workflow": "implement"
    },
    {
      "run_attempt": 1,
      "run_id": "40012201897",
      "status": "closed",
      "timestamp": "2026-10-23T19:41:44Z",
      "workflow": "Internal: Issue-PR Status Sync"
    }
  ],
  "schema_version": "task_lineage.v1",
  "state": "closed",
  "updated_at": "2026-10-23T19:41:44Z"
}
